{"schema":"EDITABLE_COMPOSITION_PACKAGE_V1","template_id":"JIPBAP_PRESENTATION_SHELL_V2","page":{"width":1080,"height":1350,"background":"#fff9f0","page_type":"body","avoid_regions":[{"x":500,"y":150,"width":480,"height":580,"role":"face_primary","priority":1.0},{"x":240,"y":870,"width":820,"height":430,"role":"food_primary","priority":0.9}],"placement_guides":[{"x":48,"y":48,"width":984,"height":1254,"role":"soft_safe_inset","priority":0.2}]},"objects":[{"id":"s06_art","type":"artwork","source":"../artwork/S06.png","x":0,"y":0,"width":1080,"height":1350,"fit":"frame_crop","allow_stretch":false,"z":1,"visible":true,"rotation":0,"group_id":"s06.artwork","locked":true,"crop":{"mode":"frame_crop","scale":1,"offset_x":0,"offset_y":0,"anchor_x":0.5,"anchor_y":0.5,"allow_stretch":false,"allow_rotation":false,"clamp_to_frame":true,"editable":true}},{"id":"s06_bubble","type":"bubble","role":"speech","x":58,"y":64,"width":520,"height":142,"radius":42,"fill":"#ffffff","stroke":"#2a2a2a","stroke_width":4,"z":10,"visible":true,"rotation":0,"locked":false,"group_id":"s06.speech.01","tail":{"enabled":true,"style":"soft_curved","tip_x":525,"tip_y":258,"attach_side":"bottom","attach":0.24,"base_width":48,"curve":0.78}},{"id":"s06_speech","type":"text","role":"speech","text":"이건 밥을 더 먹게 됨.","x":82,"y":84,"width":472,"height":102,"font":{"family_intent":"friendly_round_body","preferred_family":"Jua","fallback_families":["Gowun Dodum","Noto Sans KR","sans-serif"],"weight":700,"size":42},"fill":"#221f1d","align":"center","rotation":0,"z":11,"visible":true,"locked":false,"group_id":"s06.speech.01"}],"scene_model":"EDITOR_SCENE_MODEL_V1","groups":[{"id":"s06.background","parent_id":null,"role":"background","z_band":[0,0],"visible":true,"locked":true},{"id":"s06.artwork","parent_id":null,"role":"artwork","z_band":[1,9],"visible":true,"locked":true,"interaction":{"frame_transform":"locked","crop":"editable"}},{"id":"s06.lettering","parent_id":null,"role":"lettering","z_band":[10,99],"visible":true,"locked":false},{"id":"s06.overlay","parent_id":null,"role":"overlay","z_band":[100,199],"visible":true,"locked":false},{"id":"s06.speech.01","parent_id":"s06.lettering","role":"speech","z_band":[10,99],"visible":true,"locked":false}]}