{
  "schema": "EDITABLE_COMPOSITION_PACKAGE_V1",
  "template_id": "JIPBAP_PRESENTATION_SHELL_V1",
  "page": {
    "width": 1080,
    "height": 1350,
    "background": "#fff9f0",
    "page_type": "cover"
  },
  "objects": [
    {
      "id": "cover_menu_tag_bg",
      "type": "shape",
      "shape": "rounded_rect",
      "x": 60,
      "y": 48,
      "width": 260,
      "height": 60,
      "radius": 25,
      "fill": "#e0562b",
      "z": 10,
      "visible": true,
      "rotation": 0,
      "locked": false,
      "group_id": "cover.menu_tag"
    },
    {
      "id": "cover_menu_tag",
      "type": "text",
      "role": "menu_tag",
      "text": "김치볶음밥",
      "x": 88,
      "y": 61,
      "width": 210,
      "height": 38,
      "font": {
        "family_intent": "NanumSquareRound",
        "weight": 700,
        "size": 31
      },
      "fill": "#ffffff",
      "rotation": 0,
      "z": 11,
      "visible": true,
      "locked": false,
      "group_id": "cover.menu_tag"
    },
    {
      "id": "cover_title_1",
      "type": "text",
      "role": "title",
      "text": "노른자 터지면",
      "x": 60,
      "y": 132,
      "width": 900,
      "height": 90,
      "font": {
        "family_intent": "NanumSquareRound",
        "weight": 700,
        "size": 82
      },
      "fill": "#221f1d",
      "rotation": 0,
      "z": 20,
      "visible": true,
      "locked": false,
      "group_id": "cover.title"
    },
    {
      "id": "cover_title_2",
      "type": "text",
      "role": "title",
      "text": "게임 끝",
      "x": 60,
      "y": 214,
      "width": 600,
      "height": 120,
      "font": {
        "family_intent": "NanumSquareRound",
        "weight": 700,
        "size": 112
      },
      "fill": "#e0562b",
      "rotation": 0,
      "z": 20,
      "visible": true,
      "locked": false,
      "group_id": "cover.title"
    },
    {
      "id": "cover_art",
      "type": "artwork",
      "source": "../artwork/S04.png",
      "x": 60,
      "y": 330,
      "width": 960,
      "height": 960,
      "fit": "contain_1to1",
      "allow_stretch": false,
      "z": 1,
      "visible": true,
      "rotation": 0,
      "group_id": "cover.artwork",
      "locked": true,
      "crop": {
        "mode": "frame_crop",
        "scale": 1,
        "offset_x": 0,
        "offset_y": 0,
        "anchor_x": 0.5,
        "anchor_y": 0.5,
        "allow_stretch": false,
        "allow_rotation": false,
        "clamp_to_frame": true,
        "editable": true
      }
    }
  ],
  "scene_model": "EDITOR_SCENE_MODEL_V1",
  "groups": [
    {
      "id": "cover.background",
      "parent_id": null,
      "role": "background",
      "z_band": [
        0,
        0
      ],
      "visible": true,
      "locked": true
    },
    {
      "id": "cover.artwork",
      "parent_id": null,
      "role": "artwork",
      "z_band": [
        1,
        9
      ],
      "visible": true,
      "locked": true,
      "interaction": {
        "frame_transform": "locked",
        "crop": "editable"
      }
    },
    {
      "id": "cover.lettering",
      "parent_id": null,
      "role": "lettering",
      "z_band": [
        10,
        99
      ],
      "visible": true,
      "locked": false
    },
    {
      "id": "cover.overlay",
      "parent_id": null,
      "role": "overlay",
      "z_band": [
        100,
        199
      ],
      "visible": true,
      "locked": false
    },
    {
      "id": "cover.menu_tag",
      "parent_id": "cover.lettering",
      "role": "menu_tag",
      "z_band": [
        10,
        99
      ],
      "visible": true,
      "locked": false
    },
    {
      "id": "cover.title",
      "parent_id": "cover.lettering",
      "role": "title",
      "z_band": [
        10,
        99
      ],
      "visible": true,
      "locked": false
    }
  ]
}
