{"schema":"EDITABLE_COMPOSITION_PACKAGE_V1","template_id":"JIPBAP_PRESENTATION_SHELL_V2","page":{"width":1080,"height":1350,"background":"#fff9f0","page_type":"body","avoid_regions":[{"x":100,"y":250,"width":880,"height":850,"role":"food_primary","priority":1.0}],"placement_guides":[{"x":48,"y":48,"width":984,"height":1254,"role":"soft_safe_inset","priority":0.2}]},"objects":[{"id":"s01_art","type":"artwork","source":"../artwork/S01.png","x":0,"y":0,"width":1080,"height":1350,"fit":"frame_crop","allow_stretch":false,"z":1,"visible":true,"rotation":0,"group_id":"s01.artwork","locked":true,"crop":{"mode":"frame_crop","scale":1,"offset_x":0,"offset_y":0,"anchor_x":0.5,"anchor_y":0.5,"allow_stretch":false,"allow_rotation":false,"clamp_to_frame":true,"editable":true}},{"id":"s01_cap_bg","type":"shape","shape":"rounded_rect","x":54,"y":56,"width":540,"height":96,"radius":22,"fill":"#fff7e8","stroke":"#c7ad91","stroke_width":2,"opacity":0.92,"z":10,"visible":true,"rotation":0,"locked":false,"group_id":"s01.narration.01"},{"id":"s01_cap","type":"text","role":"narration","text":"팬 열자마자 냄새 확.","x":80,"y":72,"width":488,"height":64,"font":{"family_intent":"friendly_round_body","preferred_family":"Gowun Dodum","fallback_families":["Noto Sans KR","sans-serif"],"weight":500,"size":36},"fill":"#3a2c24","align":"left","rotation":0,"z":11,"visible":true,"locked":false,"group_id":"s01.narration.01"}],"scene_model":"EDITOR_SCENE_MODEL_V1","groups":[{"id":"s01.background","parent_id":null,"role":"background","z_band":[0,0],"visible":true,"locked":true},{"id":"s01.artwork","parent_id":null,"role":"artwork","z_band":[1,9],"visible":true,"locked":true,"interaction":{"frame_transform":"locked","crop":"editable"}},{"id":"s01.lettering","parent_id":null,"role":"lettering","z_band":[10,99],"visible":true,"locked":false},{"id":"s01.overlay","parent_id":null,"role":"overlay","z_band":[100,199],"visible":true,"locked":false},{"id":"s01.narration.01","parent_id":"s01.lettering","role":"narration","z_band":[10,99],"visible":true,"locked":false}]}