{"schema":"EDITABLE_COMPOSITION_PACKAGE_V1","template_id":"JIPBAP_PRESENTATION_SHELL_V2","page":{"width":1080,"height":1350,"background":"#fff9f0","page_type":"body","avoid_regions":[{"x":250,"y":430,"width":780,"height":820,"role":"food_primary","priority":1.0}],"placement_guides":[{"x":48,"y":48,"width":984,"height":1254,"role":"soft_safe_inset","priority":0.2}]},"objects":[{"id":"s03_art","type":"artwork","source":"../artwork/S03.png","x":0,"y":0,"width":1080,"height":1350,"fit":"frame_crop","allow_stretch":false,"z":1,"visible":true,"rotation":0,"group_id":"s03.artwork","locked":true,"crop":{"mode":"frame_crop","scale":1,"offset_x":0,"offset_y":0,"anchor_x":0.5,"anchor_y":0.5,"allow_stretch":false,"allow_rotation":false,"clamp_to_frame":true,"editable":true}},{"id":"s03_thought_box","type":"thought_box","role":"inner_thought","x":56,"y":70,"width":650,"height":150,"radius":24,"fill":"#fff7e8","stroke":"#b7a995","stroke_width":2,"opacity":0.92,"z":10,"visible":true,"rotation":0,"locked":false,"group_id":"s03.thought.01"},{"id":"s03_thought","type":"text","role":"inner_thought","text":"양념 밥에 좀 묻혀서.","x":84,"y":94,"width":594,"height":102,"font":{"family_intent":"friendly_round_body","preferred_family":"Gowun Dodum","fallback_families":["Jua","Noto Sans KR","sans-serif"],"weight":400,"size":38},"fill":"#392d26","align":"center","rotation":0,"z":11,"visible":true,"locked":false,"group_id":"s03.thought.01"}],"scene_model":"EDITOR_SCENE_MODEL_V1","groups":[{"id":"s03.background","parent_id":null,"role":"background","z_band":[0,0],"visible":true,"locked":true},{"id":"s03.artwork","parent_id":null,"role":"artwork","z_band":[1,9],"visible":true,"locked":true,"interaction":{"frame_transform":"locked","crop":"editable"}},{"id":"s03.lettering","parent_id":null,"role":"lettering","z_band":[10,99],"visible":true,"locked":false},{"id":"s03.overlay","parent_id":null,"role":"overlay","z_band":[100,199],"visible":true,"locked":false},{"id":"s03.thought.01","parent_id":"s03.lettering","role":"inner_thought","z_band":[10,99],"visible":true,"locked":false}]}