{
  "schema": "EDITABLE_COMPOSITION_PACKAGE_V1",
  "template_id": "JIPBAP_PRESENTATION_SHELL_V1",
  "page": {
    "width": 1080,
    "height": 1350,
    "background": "#fff9f0",
    "page_type": "body"
  },
  "objects": [
    {
      "id": "s03_art",
      "type": "artwork",
      "source": "../artwork/S03.png",
      "x": 40,
      "y": 175,
      "width": 1000,
      "height": 1000,
      "fit": "contain_1to1",
      "allow_stretch": false,
      "z": 1,
      "visible": true,
      "rotation": 0,
      "group_id": "s03.artwork",
      "locked": true,
      "crop": {
        "mode": "frame_crop",
        "scale": 1,
        "offset_x": 0,
        "offset_y": 0,
        "anchor_x": 0.5,
        "anchor_y": 0.5,
        "allow_stretch": false,
        "allow_rotation": false,
        "clamp_to_frame": true,
        "editable": true
      }
    },
    {
      "id": "s03_thought",
      "type": "thought_box",
      "role": "inner_thought",
      "x": 70,
      "y": 1182,
      "width": 940,
      "height": 128,
      "fill": "#fff7e8",
      "stroke": "#b7a995",
      "stroke_width": 2,
      "z": 10,
      "visible": true,
      "rotation": 0,
      "locked": false,
      "group_id": "s03.thought.01"
    },
    {
      "id": "s03_text",
      "type": "text",
      "role": "inner_thought",
      "text": "오… 노른자 섞이니까\n매운맛이 확 부드러워지네.",
      "x": 96,
      "y": 1202,
      "width": 888,
      "height": 90,
      "font": {
        "family_intent": "NanumSquareRound",
        "weight": 400,
        "size": 39
      },
      "fill": "#221f1d",
      "rotation": 0,
      "z": 11,
      "visible": true,
      "locked": false,
      "group_id": "s03.thought.01"
    }
  ],
  "scene_model": "EDITOR_SCENE_MODEL_V1",
  "groups": [
    {
      "id": "s03.background",
      "parent_id": null,
      "role": "background",
      "z_band": [
        0,
        0
      ],
      "visible": true,
      "locked": true
    },
    {
      "id": "s03.artwork",
      "parent_id": null,
      "role": "artwork",
      "z_band": [
        1,
        9
      ],
      "visible": true,
      "locked": true,
      "interaction": {
        "frame_transform": "locked",
        "crop": "editable"
      }
    },
    {
      "id": "s03.lettering",
      "parent_id": null,
      "role": "lettering",
      "z_band": [
        10,
        99
      ],
      "visible": true,
      "locked": false
    },
    {
      "id": "s03.overlay",
      "parent_id": null,
      "role": "overlay",
      "z_band": [
        100,
        199
      ],
      "visible": true,
      "locked": false
    },
    {
      "id": "s03.thought.01",
      "parent_id": "s03.lettering",
      "role": "inner_thought",
      "z_band": [
        10,
        99
      ],
      "visible": true,
      "locked": false
    }
  ]
}
