{
  "schema": "EDITABLE_COMPOSITION_PACKAGE_V1",
  "template_id": "JIPBAP_PRESENTATION_SHELL_V1",
  "page": {
    "width": 1080,
    "height": 1350,
    "background": "#fff9f0",
    "page_type": "body"
  },
  "objects": [
    {
      "id": "s05_art",
      "type": "artwork",
      "source": "../artwork/S05.png",
      "x": 40,
      "y": 175,
      "width": 1000,
      "height": 1000,
      "fit": "contain_1to1",
      "allow_stretch": false,
      "z": 1,
      "visible": true,
      "rotation": 0,
      "group_id": "s05.artwork",
      "locked": true,
      "crop": {
        "mode": "frame_crop",
        "scale": 1,
        "offset_x": 0,
        "offset_y": 0,
        "anchor_x": 0.5,
        "anchor_y": 0.5,
        "allow_stretch": false,
        "allow_rotation": false,
        "clamp_to_frame": true,
        "editable": true
      }
    },
    {
      "id": "s05_bubble",
      "type": "bubble",
      "role": "speech",
      "x": 70,
      "y": 40,
      "width": 300,
      "height": 105,
      "tail_to": {
        "x": 250,
        "y": 225
      },
      "fill": "#ffffff",
      "stroke": "#221f1d",
      "stroke_width": 4,
      "z": 10,
      "visible": true,
      "rotation": 0,
      "locked": false,
      "group_id": "s05.speech.01"
    },
    {
      "id": "s05_speech",
      "type": "text",
      "role": "speech",
      "text": "아 뜨거…",
      "x": 98,
      "y": 62,
      "width": 245,
      "height": 60,
      "font": {
        "family_intent": "NanumSquareRound",
        "weight": 700,
        "size": 40
      },
      "fill": "#221f1d",
      "rotation": 0,
      "z": 11,
      "visible": true,
      "locked": false,
      "group_id": "s05.speech.01"
    },
    {
      "id": "s05_thought",
      "type": "thought_box",
      "role": "inner_thought",
      "x": 410,
      "y": 1182,
      "width": 600,
      "height": 128,
      "fill": "#fff7e8",
      "stroke": "#b7a995",
      "stroke_width": 2,
      "z": 10,
      "visible": true,
      "rotation": 0,
      "locked": false,
      "group_id": "s05.thought.01"
    },
    {
      "id": "s05_thought_text",
      "type": "text",
      "role": "inner_thought",
      "text": "김치는 아삭하고,\n노른자는 부드럽게 감싸네.",
      "x": 436,
      "y": 1202,
      "width": 548,
      "height": 90,
      "font": {
        "family_intent": "NanumSquareRound",
        "weight": 400,
        "size": 37
      },
      "fill": "#221f1d",
      "rotation": 0,
      "z": 11,
      "visible": true,
      "locked": false,
      "group_id": "s05.thought.01"
    }
  ],
  "scene_model": "EDITOR_SCENE_MODEL_V1",
  "groups": [
    {
      "id": "s05.background",
      "parent_id": null,
      "role": "background",
      "z_band": [
        0,
        0
      ],
      "visible": true,
      "locked": true
    },
    {
      "id": "s05.artwork",
      "parent_id": null,
      "role": "artwork",
      "z_band": [
        1,
        9
      ],
      "visible": true,
      "locked": true,
      "interaction": {
        "frame_transform": "locked",
        "crop": "editable"
      }
    },
    {
      "id": "s05.lettering",
      "parent_id": null,
      "role": "lettering",
      "z_band": [
        10,
        99
      ],
      "visible": true,
      "locked": false
    },
    {
      "id": "s05.overlay",
      "parent_id": null,
      "role": "overlay",
      "z_band": [
        100,
        199
      ],
      "visible": true,
      "locked": false
    },
    {
      "id": "s05.speech.01",
      "parent_id": "s05.lettering",
      "role": "speech",
      "z_band": [
        10,
        99
      ],
      "visible": true,
      "locked": false
    },
    {
      "id": "s05.thought.01",
      "parent_id": "s05.lettering",
      "role": "inner_thought",
      "z_band": [
        10,
        99
      ],
      "visible": true,
      "locked": false
    }
  ]
}
