{"schema":"EDITABLE_COMPOSITION_PACKAGE_V1","template_id":"JIPBAP_PRESENTATION_SHELL_V2","page":{"width":1080,"height":1350,"background":"#fff9f0","page_type":"cover","placement_guides":[{"x":48,"y":36,"width":984,"height":330,"role":"title_safe","priority":0.5}],"cover_artwork_provenance":{"source":"../artwork/COVER_APPROVED.png","source_kind":"previously_approved_cover_visual","source_page_id":null,"source_sha256":"12a701747e5fafc9ad36f20f729d91496f553a0d8a1b81c862d102f130b78a89","crop":{"mode":"frame_crop","scale":1,"offset_x":0,"offset_y":0,"anchor_x":0.5,"anchor_y":0.5},"locked_for_final_candidate":true},"avoid_regions":[{"x":420,"y":305,"width":610,"height":690,"role":"face_primary","priority":1.0},{"x":120,"y":520,"width":470,"height":430,"role":"food_primary","priority":1.0},{"x":0,"y":1000,"width":1080,"height":350,"role":"food_primary","priority":0.9}]},"objects":[{"id":"cover_art","type":"artwork","source":"../artwork/COVER_APPROVED.png","x":0,"y":0,"width":1080,"height":1350,"fit":"frame_crop","allow_stretch":false,"z":1,"visible":true,"rotation":0,"group_id":"cover.artwork","locked":true,"crop":{"mode":"frame_crop","scale":1,"offset_x":0,"offset_y":0,"anchor_x":0.5,"anchor_y":0.5,"allow_stretch":false,"allow_rotation":false,"clamp_to_frame":true,"editable":true}},{"id":"cover_baked_tag_mask","type":"shape","shape":"rounded_rect","x":250,"y":20,"width":600,"height":115,"radius":0,"fill":"#f8edda","stroke":"none","stroke_width":0,"z":8,"visible":true,"rotation":0,"locked":true,"group_id":"cover.artwork"},{"id":"cover_baked_title_mask","type":"shape","shape":"rounded_rect","x":15,"y":125,"width":1050,"height":205,"radius":0,"fill":"#f8edda","stroke":"none","stroke_width":0,"z":9,"visible":true,"rotation":0,"locked":true,"group_id":"cover.artwork"},{"id":"cover_baked_fragment_mask","type":"shape","shape":"rounded_rect","x":150,"y":300,"width":235,"height":43,"radius":0,"fill":"#f8edda","stroke":"none","stroke_width":0,"z":9,"visible":true,"rotation":0,"locked":true,"group_id":"cover.artwork"},{"id":"cover_tag_bg","type":"shape","shape":"rounded_rect","x":330,"y":38,"width":420,"height":78,"radius":38,"fill":"#fff4df","stroke":"#5b3525","stroke_width":3,"z":10,"visible":true,"rotation":0,"locked":false,"group_id":"cover.menu_tag"},{"id":"cover_tag","type":"text","role":"menu_tag","text":"집밥 3화 · 제육볶음","x":355,"y":49,"width":370,"height":55,"font":{"family_intent":"friendly_round_display","preferred_family":"Jua","fallback_families":["Do Hyeon","Noto Sans KR","sans-serif"],"weight":700,"size":31},"fill":"#5b3525","align":"center","rotation":0,"z":11,"visible":true,"locked":false,"group_id":"cover.menu_tag"},{"id":"cover_title_red","type":"text","role":"title","text":"제육은","x":45,"y":145,"width":320,"height":150,"font":{"family_intent":"friendly_handdrawn_display","preferred_family":"Jua","fallback_families":["Do Hyeon","Black Han Sans","Noto Sans KR","sans-serif"],"weight":700,"size":128},"fill":"#d93c16","align":"left","rotation":0,"z":20,"visible":true,"locked":false,"group_id":"cover.title"},{"id":"cover_title_dark","type":"text","role":"title","text":"밥을 늘린다","x":350,"y":150,"width":690,"height":145,"font":{"family_intent":"friendly_handdrawn_display","preferred_family":"Jua","fallback_families":["Do Hyeon","Black Han Sans","Noto Sans KR","sans-serif"],"weight":700,"size":112},"fill":"#341a12","align":"left","rotation":0,"z":20,"visible":true,"locked":false,"group_id":"cover.title"}],"scene_model":"EDITOR_SCENE_MODEL_V1","groups":[{"id":"cover.background","parent_id":null,"role":"background","z_band":[0,0],"visible":true,"locked":true},{"id":"cover.artwork","parent_id":null,"role":"artwork","z_band":[1,9],"visible":true,"locked":true,"interaction":{"frame_transform":"locked","crop":"editable"}},{"id":"cover.lettering","parent_id":null,"role":"lettering","z_band":[10,99],"visible":true,"locked":false},{"id":"cover.overlay","parent_id":null,"role":"overlay","z_band":[100,199],"visible":true,"locked":false},{"id":"cover.menu_tag","parent_id":"cover.lettering","role":"menu_tag","z_band":[10,99],"visible":true,"locked":false},{"id":"cover.title","parent_id":"cover.lettering","role":"title","z_band":[10,99],"visible":true,"locked":false}]}